username;date;retweets;favorites;text;geo;mentions;hashtags;id;permalink
PeHSalerno;2018-08-03 15:57;2;8;"quando você achar que está desperdiçando dinheiro lembre que o Henrique Meirelles tá bancando a própria campanha sendo que o MDB recebeu 234 milhões de fundo partidário";;;;"1025455599033745409";https://twitter.com/PeHSalerno/status/1025455599033745409
Adrieli_S;2018-08-02 23:16;3188;5779;"A Emenda Constitucional 95 é apoiada pelos seguintes presidenciáveis: Álvaro Dias Geraldo Alckmin Henrique Meirelles João Amoêdo Jair Bolsonaro SEMPRE BOM LEMBRAR QUEM ESTÁ JOGANDO A PÁ DE TERRA NA CIÊNCIA, INOVAÇÃO, PESQUISA E TECNOLOGIA DO PAÍS.";;;;"1025203814238957568";https://twitter.com/Adrieli_S/status/1025203814238957568
psamarco_BR;2018-08-02 21:19;17;28;"A candidatura de Henrique Meirelles é apenas para afastar a imagem do Temer em apoio a Alckmin. Vai ser tipo aquela combinação do pastor Everaldo, que ganhou dinheiro para fazer perguntas favoráveis a Aécio Neves. Essa turma do golpe não dá ponto sem nó. #Jn #JornalNacional";;;#Jn #JornalNacional;"1025174339551932417";https://twitter.com/psamarco_BR/status/1025174339551932417
sensacionalista;2018-08-02 15:41;366;1712;"Henrique Meirelles mostra que não entende de economia ao gastar dinheiro com candidatura de Henrique Meirelles pic.twitter.com/DMyWmE9V5z";;;;"1025089177317044224";https://twitter.com/sensacionalista/status/1025089177317044224
rodrigo__goes;2018-08-02 14:37;5;5;"O presidente perdeu a linha. Olha o tom: "Nossos adversários são uns pobres coitados. Como não têm projeto, vão para a baixaria. Nós não somos pigmeus. O MDB é feito de gigantes". Michel Temer, sobre a candidatura de Henrique Meirelles .";;;;"1025073230808276996";https://twitter.com/rodrigo__goes/status/1025073230808276996
matheusblack26;2018-08-09 19:00;0;0;"Henrique Meirelles";;;;"1027676133905580033";https://twitter.com/matheusblack26/status/1027676133905580033
lucasealvimm;2018-08-09 14:58;0;0;"Hoje às 22h tem o primeiro debate para presidência, na Band. Participarão: Alvaro Dias (Podemos), Cabo Daciolo (Patriota), Ciro Gomes (PDT), Geraldo Alckmin (PSDB), Guilherme Boulos (PSOL), Henrique Meirelles (MDB), Jair Bolsonaro (PSL) e Marina Silva (Rede).";;;;"1027615048783618049";https://twitter.com/lucasealvimm/status/1027615048783618049
ovitormafra;2018-08-09 12:05;0;1;"Se você estiver se sentindo perdido, lembre-se que o Henrique Meirelles é candidato a presidência - não tá fácil pra ninguém mesmo";;;;"1027571517788483584";https://twitter.com/ovitormafra/status/1027571517788483584
mastipp;2018-08-09 08:01;2;13;"É só imaginação de vcs, pessoal. Henrique Meirelles : Imagem de que sou banqueiro não existe, é uma coisa forçada https:// www1.folha.uol.com.br/poder/2018/08/ henrique-meirelles-imagem-de-que-sou-banqueiro-nao-existe-e-uma-coisa-forcada.shtml?utm_source=twitter&utm_medium=social&utm_campaign=comptw …";;;;"1027510101794586625";https://twitter.com/mastipp/status/1027510101794586625
StarsInsider_BR;2018-08-09 07:53;2;3;"Hoje acontece o primeiro debate com candidatos à presidência do Brasil na @redebandeirante !!! Veja: https:// bit.ly/2KH4Ldc #CiroGomes #MarinaSilva #GeraldoAlckmin #JairBolsonaro #GuilhermeBoulos #ÁlvaroDias #CaboDaciolo #HenriqueMeirelles #Eleições2018 pic.twitter.com/cSquSXC96s";;@redebandeirante;#CiroGomes #MarinaSilva #GeraldoAlckmin #JairBolsonaro #GuilhermeBoulos # #CaboDaciolo #HenriqueMeirelles #Elei;"1027508240828039168";https://twitter.com/StarsInsider_BR/status/1027508240828039168
BlogdoNoblat;2018-08-09 04:24;10;37;"Quer irritar Henrique Meirelles , candidato do PMDB a presidente? Chame ele de banqueiro. Ele nega que seja. Foi apenas presidente do Banco de Boston no Brasil por 8 anos, presidente mundial do mesmo banco por mais 3 anos e presidente do Banco Central por outros 8 anos. pic.twitter.com/LsaodYTMOM";;;;"1027455507710324737";https://twitter.com/BlogdoNoblat/status/1027455507710324737
pmniemeyer;2018-08-07 11:30;2;3;"SAIU A LISTA DOS CANDIDATOS CONFIRMADOS NO DEBATE DA BAND, QUE SE REALIZARÁ NESTA QUINTA - 09/08/18 ÀS 22:00 Hs! Álvaro Dias Cabo Daciolo Ciro Gomes Marina Silva Geraldo Alckmin Guilherme Boulos Henrique Meirelles Jair Bolsonaro Marina Silva #votoconsciente";;;#votoconsciente;"1026837919288446976";https://twitter.com/pmniemeyer/status/1026837919288446976
RTopiniao;2018-08-05 14:44;3;6;"MDB confirma Germano Rigotto como vice de Henrique Meirelles https://www. diariodocentrodomundo.com.br/essencial/mdb- confirma-germano-rigotto-como-vice-de-henrique-meirelles/ …";;;;"1026162110311616512";https://twitter.com/RTopiniao/status/1026162110311616512
Carolina_Bahia;2018-08-04 16:50;4;49;"“Que Deus me Ilumine”, afirma Rigotto, ao falar pela primeira vez como vice na chapa de Henrique Meirelles . @GauchaZH";;@GauchaZH;;"1025831369753145344";https://twitter.com/Carolina_Bahia/status/1025831369753145344
frednavarro;2018-08-04 12:42;3;15;"A vaidade e o ego de Henrique Meirelles são maiores do que sua fortuna. Como se diz no Nordeste, é um candidato “alinhado que só meio-fio”.";;;;"1025768999022284801";https://twitter.com/frednavarro/status/1025768999022284801
lcportinho;2018-08-04 11:42;11;10;"A Emenda Constitucional 95 é apoiada pelos seguintes presidenciáveis: Álvaro Dias Geraldo Alckmin Henrique Meirelles João Amoêdo Jair Bolsonaro SEMPRE BOM LEMBRAR QUEM ESTÁ JOGANDO A PÁ DE TERRA NA CIÊNCIA, INOVAÇÃO, PESQUISA E TECNOLOGIA DO PAÍS.";;;;"1025753852287635456";https://twitter.com/lcportinho/status/1025753852287635456