username;date;retweets;favorites;text;geo;mentions;hashtags;id;permalink
rodsgo;2018-08-09 21:54;1;0;"candidatura do Henrique Meirelles é a mais errada";;;;"1027719736874950656";https://twitter.com/rodsgo/status/1027719736874950656
lemiroirnoir;2018-08-09 21:53;0;0;"meu aniversario coincide só com desgraça morte da princesa diana impeachment da dilma nascimento do henrique meirelles";;;;"1027719616083177472";https://twitter.com/lemiroirnoir/status/1027719616083177472
destak;2018-08-09 21:35;2;13;"'Sou o candidato da renda, do progresso' é a frase de Henrique Meirelles na entrada da Band para o debate: pic.twitter.com/mKbghPakWj";;;;"1027715024939307008";https://twitter.com/destak/status/1027715024939307008
JoaoGAnjos;2018-08-09 21:30;0;1;"Álvaro Dias e Henrique Meirelles estão no debate da @BandTV . @joaoamoedonovo não está. Muito estranho. Eu queria saber qual o critério. #DebateBand";;@BandTV @joaoamoedonovo;#DebateBand;"1027713865306529800";https://twitter.com/JoaoGAnjos/status/1027713865306529800
RevistaISTOE;2018-08-09 21:18;9;39;"#ELEIÇÕES2018 Hoje às 22h acontece o primeiro debate com os candidatos à Presidência da República na Band. Os presidenciáveis Geraldo Alckmin, Jair Bolsonaro, Guilherme Boulos, Álvaro Dias, Cabo Daciolo, Marina Silva, Henrique Meirelles e Ciro Gomes já chegaram nos estúdios pic.twitter.com/JCMAIuXhVI";;;#ELEI;"1027710743611891713";https://twitter.com/RevistaISTOE/status/1027710743611891713
TvBandnews;2018-08-09 21:10;6;14;"#DebateBand : Chega ao Grupo Bandeirantes de Comunicação o candidato ao Planalto pelo MDB, Henrique Meirelles . pic.twitter.com/A3yKu9xns1";;;#DebateBand;"1027708688264572928";https://twitter.com/TvBandnews/status/1027708688264572928
MarkosOliveira;2018-08-09 20:29;13;43;"Henrique Meirelles , candidato do PMDB acha que o casamento entre pessoas do mesmo gênero "não pode ser nem propagado, nem proibido". Tb acho que o casamento entre heteros deveria parar de ser propagado. Nos pouparia muitos clichês em finais de novela. https:// m.oglobo.globo.com/brasil/henriqu e-meirelles-desconversa-sobre-protecao-grupo-de-temer-caso-eleito-22951871 … pic.twitter.com/FVjfBsvmf9";;;;"1027698512329420801";https://twitter.com/MarkosOliveira/status/1027698512329420801
rosa_riscala;2018-08-09 19:30;6;40;"Participam do debate na Band hoje (22h): Jair Bolsonaro (PSL), Geraldo Alckmin (PSDB), Marina Silva (Rede), Ciro Gomes (PDT), Alvaro Dias (Pode), Henrique Meirelles (MDB), Guilherme Boulos (PSOL) e Cabo Daciolo (Patri).";;;;"1027683601377374208";https://twitter.com/rosa_riscala/status/1027683601377374208
BlogDoPim;2018-08-09 18:11;499;2469;"Marina Silva será clara e assertiva no #DebateBand ? Admitirá que Lula cometeu crimes, não “erros”? Henrique Meirelles e Alvaro Dias conseguirão ser cativantes e ganhar um protagonismo que não têm? Guilherme Boulos invadirá o espaço dos outros para roubar a cena? Separem a pipoca.";;;#DebateBand;"1027663805042622466";https://twitter.com/BlogDoPim/status/1027663805042622466
usevitor;2018-08-09 17:51;0;1;"Brazilian horror story: Henrique meirelles";;;;"1027658742278565889";https://twitter.com/usevitor/status/1027658742278565889
brunopsda;2018-08-09 17:08;5;10;"Guilherme Boulos no debate: Vou invadir a sua Propriedade. Marina Silva no debate: Vamos tomar um suco detox; Henrique Meirelles no debate: Falando algo que não é possível entender; Ciro Gomes no debate: Viado filho da puta, pra casa;";;;;"1027647889932210176";https://twitter.com/brunopsda/status/1027647889932210176
willmummy;2018-08-09 12:21;16;46;"Caiu de 1% para 0,7% a intenção de voto no Henrique Meirelles . É a força eleitoral do Temer começando a funcionar!!!";;;;"1027575715309477888";https://twitter.com/willmummy/status/1027575715309477888
omatheuslima_;2018-08-07 12:28;72;273;"A Coluna do Estadão publica que, como Jair Bolsonaro não desidratou como se esperava, as campanhas de Henrique Meirelles e Geraldo Alckmin vão atacá-lo com vídeos que mostram Bolsonaro descontrolado ou dizendo bobagens. So não dá para dizer que Bolsonaro é corrupto.";;;;"1026852616523931648";https://twitter.com/omatheuslima_/status/1026852616523931648
GABRELPlNHEIRO;2018-08-06 23:11;50;360;"Candidatos que vão no debate da Band, quinta: Jair Bolsonaro Marina Silva Ciro Gomes Geraldo Alckmin Henrique Meirelles Alvaro Dias Cabo Daciolo Guilherme Boulos";;;;"1026652119527567360";https://twitter.com/GABRELPlNHEIRO/status/1026652119527567360
miltonjung;2018-08-06 09:58;156;481;"Candidatos a Presidente Jair Bolsonaro (PSL) Lula (PT) Geraldo Alckmin (PSDB) Marina Silva (Rede) Ciro Gomes (PDT) Henrique Meirelles (MDB) Alvaro Dias (Podemos) Guilherme Boulos (PSOL) João Amoêdo (Novo) Eymael (DC) Vera Lúcia(PSTU) João Goulart F (PPL) Cabo Daciolo (Patriotas)";;;;"1026452408300445696";https://twitter.com/miltonjung/status/1026452408300445696
boorigoni;2018-08-09 21:54;0;1;"henrique meirelles morre AO VIVO no debate";;;;"1027719760254042112";https://twitter.com/boorigoni/status/1027719760254042112
guilefreitas;2018-08-09 21:53;0;0;"já dá pra falar que o Henrique Meirelles é a figura mais triste do #DebateBand ?";;;#DebateBand;"1027719642939318272";https://twitter.com/guilefreitas/status/1027719642939318272
daniel_hd;2018-08-09 21:37;0;0;"henrique meirelles não ganha nem pra prefeito de Anapolis, que dirá dono das capitanias hereditárias";;;;"1027715515802955776";https://twitter.com/daniel_hd/status/1027715515802955776
vulgomatias;2018-08-09 21:30;2;1;"Estarão presentes Álvaro Dias (Podemos), Cabo Daciolo (Patriota), Ciro Gomes (PDT), Geraldo Alckmin (PSDB), Guilherme Boulos (PSOL), Henrique Meirelles (MDB), Jair Bolsonaro (PSL) e Marina Silva (Rede).";;;;"1027713870838857729";https://twitter.com/vulgomatias/status/1027713870838857729
catracalivre;2018-08-09 21:13;1;6;"Henrique Meirelles (MDB) também está presente. #DebateBand pic.twitter.com/mO50XV4f1B";;;#DebateBand;"1027709413526622208";https://twitter.com/catracalivre/status/1027709413526622208
sergiomatarazzo;2018-08-09 21:13;0;2;"Henrique Meirelles quer aplicar novamente a política do Lula. E prometeu deixar só 3 milhões de desempregados no final do seu governo! Ah bom! Na próxima pesquisa vai dar traço! Sempre foi cupincha do Lula, só isso!";;;;"1027709385873731584";https://twitter.com/sergiomatarazzo/status/1027709385873731584
radiobandnewsfm;2018-08-09 21:10;3;9;"O presidenciável Henrique Meirelles , do MDB, chega ao Grupo Bandeirantes de Comunicação para o #DebateBand pic.twitter.com/waZOWTs8X8";;;#DebateBand;"1027708654424866816";https://twitter.com/radiobandnewsfm/status/1027708654424866816
Nath_Any1;2018-08-09 21:10;0;0;"Henrique Meirelles fez plástica nos olhos???";;;;"1027708624351703040";https://twitter.com/Nath_Any1/status/1027708624351703040
Joao_Bieski;2018-08-09 19:59;0;0;"Henrique Meirelles vai dar um pau em geral hoje no debate, na parte econômica pelo menos,quase crtz";;;;"1027690881967693825";https://twitter.com/Joao_Bieski/status/1027690881967693825
Joseph_Bentes;2018-08-09 13:10;1;1;"Hoje tem TALCKMIN, Marina, Bolsominion, Cirão da massa, Henrique Meirelles E BOULOS! BOULOS!";;;;"1027587997838008322";https://twitter.com/Joseph_Bentes/status/1027587997838008322
vinibanshee;2018-08-09 10:09;18;20;"Geraldo Alckmin - R$ 828,1 milhões Lula - R$ 269,8 milhões Henrique Meirelles - R$ 249 milhões Alvaro Dias - R$ 83,8 milhões Ciro Gomes - R$ 73,9 milhões Marina Silva - R$ 35,3 milhões Guilherme Boulos - R$ 22,4 milhões Jair Bolsonaro - R$ 12,9 milhões https:// congressoemfoco.uol.com.br/eleicoes/colig acao-de-alckmin-vai-ficar-com-metade-de-novo-fundo-bilionario/ …";;;;"1027542281279156224";https://twitter.com/vinibanshee/status/1027542281279156224
fernandocluiz;2018-08-08 20:21;3;62;"Henrique Meirelles é otimo. pena que nao ganha. mas é otimo. E rico pela iniciativa privada, nao sendo um adendo do governo, como os demais .. Alckimin, Bozo, Ciro, etc.";;;;"1027333973536645121";https://twitter.com/fernandocluiz/status/1027333973536645121
PanichiRaphael;2018-08-07 13:54;71;116;"A esquerda e os corruptos do centrão estão unidos sim! A Coluna do Estadão publica que, como Jair Bolsonaro não desidratou como se esperava, as campanhas de Henrique Meirelles e Geraldo Alckmin vão atacá-lo com vídeos que tentem minar Bolsonaro. Você acredita nessa quadrilha? pic.twitter.com/EBJ1PA0htZ";;;;"1026874225305546752";https://twitter.com/PanichiRaphael/status/1026874225305546752
SchuldinerSieg;2018-08-07 09:37;18;182;"Lista de candidatos confirmados no debate da Band. A grande pergunta é: O que o Cabo Daciolo tá fazendo aí? Jair Bolsonaro Marina Silva Ciro Gomes Geraldo Alckmin Henrique Meirelles Alvaro Dias Cabo Daciolo Guilherme Boulos";;;;"1026809520536936448";https://twitter.com/SchuldinerSieg/status/1026809520536936448
GABRELPlNHEIRO;2018-08-06 23:12;8;140;"Mano, dava pra cortar o Henrique Meirelles , Cabo Daciolo e Guilherme Boulos Os caras tem 1 ou 2%";;;;"1026652291968000001";https://twitter.com/GABRELPlNHEIRO/status/1026652291968000001
leonelcupertino;2018-08-05 21:39;7;8;"Oito candidatos à presidência devem ir ao debate da @BandTV , na quinta-feira (9). São eles: Henrique Meirelles (MDB); Geraldo Alckmin (PSDB); Marina Silva (Rede); Ciro Gomes (PDT); Alvaro Dias (PODE); Manuela D'Ávila (PCdoB); Guilherme Boulos (PSOL); e Jair Bolsonaro (PSL).";;@BandTV;;"1026266584871051264";https://twitter.com/leonelcupertino/status/1026266584871051264
DamaresAlves_;2018-08-05 20:55;172;528;"QUE PALHAÇADA É ESTA MESMO? Os candidatos a presidência ficaram loucos? O PSDB estuda legalizar as drogas. O Meireles se eleito vai legalizar a maconha. Quem está por trás de tudo isto? Será que tem megainvestidor financiando campanhas presidenciais? https:// istoe.com.br/eleito-vou-lib erar-o-uso-da-maconha/#…";;;#;"1026255497182306304";https://twitter.com/DamaresAlves_/status/1026255497182306304
jornalistavitor;2018-08-09 21:52;0;0;"BandNews TV #DebateBand : Chega ao Grupo Bandeirantes de Comunicação o candidato ao Planalto pelo MDB, Henrique Meirelles . pic.twitter.com/WUZs9FA4ld @TvBandnews @jornalistavitor";;@TvBandnews @jornalistavitor;#DebateBand;"1027719386579300352";https://twitter.com/jornalistavitor/status/1027719386579300352
ameisaber;2018-08-09 21:47;1;2;"Quem vai assistir? #DebateBand #JairBolsonaro #BoulosNaBand #BolsonaroNaBand #GuilhermeBoulos #bolsonaro #boulos #ciro #cirogomes #CiroNaBand #estoucombolsonaro #MarinaNaBand #GeraldoAlckmin #euvotobolsonaro #alckmin #alvarodias #marinasilva #cabodaciolo #henriquemeirelles pic.twitter.com/Vu6QwxSIWq";;;#DebateBand #JairBolsonaro #BoulosNaBand #BolsonaroNaBand #GuilhermeBoulos #bolsonaro #boulos #ciro #cirogomes #CiroNaBand #estoucombolsonaro #MarinaNaBand #GeraldoAlckmin #euvotobolsonaro #alckmin #alvarodias #marinasilva #cabodaciolo #henriquemeirelles;"1027717969437237248";https://twitter.com/ameisaber/status/1027717969437237248
hiltonflu_sousa;2018-08-09 21:28;0;0;"Henrique Meirelles também";;;;"1027713298551193601";https://twitter.com/hiltonflu_sousa/status/1027713298551193601
wences_cruz;2018-08-09 21:14;0;0;"Henrique Meirelles : Vai criar 10 milhões de empregos. Sem comentários. #BandNews";;;#BandNews;"1027709772492091392";https://twitter.com/wences_cruz/status/1027709772492091392
nivasouza;2018-08-09 21:13;0;2;"Henrique Meirelles chega pro #DebateBand com grande comitiva em carro de passeio e uma van. pic.twitter.com/zntv7JmOhV";;;#DebateBand;"1027709488424464384";https://twitter.com/nivasouza/status/1027709488424464384
rahnandes9;2018-08-09 21:10;0;0;"#DebateBand O Henrique Meirelles pode surpreender. Apesar de ser do MDB.";;;#DebateBand;"1027708631997980673";https://twitter.com/rahnandes9/status/1027708631997980673
NelsonGnarlin;2018-08-09 21:09;0;0;"Henrique Meirelles defendendo o Temer no debate vai ser engraçado kkk";;;;"1027708359028498432";https://twitter.com/NelsonGnarlin/status/1027708359028498432
letanaka_;2018-08-09 16:40;0;2;"eu acabei de falar com o henrique meirelles no telefone e nem sabia se soubesse teria soltado um FOI GOLPE";;;;"1027640855417548801";https://twitter.com/letanaka_/status/1027640855417548801
BoulosGaucho;2018-08-09 13:47;0;4;"Henrique Meirelles Memes: versão sincera. pic.twitter.com/RNayBa77RO";;;;"1027597149335433216";https://twitter.com/BoulosGaucho/status/1027597149335433216
italoalves;2018-08-09 12:34;0;6;"Sonhei que o Henrique Meirelles era professor substituto no departamento e não tava conseguindo entrar na sala dos professores depois que tinham instalado fechadura eletrônica, aí tava na frente esperando algum outro professor passar pra entrar junto. Bom dia.";;;;"1027578895212728320";https://twitter.com/italoalves/status/1027578895212728320
LuizHespanha;2018-08-09 12:03;1;1;"#DebateBand Interessadíssimo nas propostas do Cabo Daciolo sobre a política nuclear brasileira e nas propostas de Henrique Meirelles sobre juros bancários e taxação das grandes fortunas.";;;#DebateBand;"1027570957286879233";https://twitter.com/LuizHespanha/status/1027570957286879233
rd1oficial;2018-08-08 14:50;16;35;"ATENÇÃO! Band acaba de informar os candidatos que estarão presentes no debate de amanhã, às 22h: Álvaro Dias (Podemos), Cabo Daciolo (Patriota), Geraldo Alckmin (PSDB), Marina Silva (Rede), Jair Bolsonaro (PSL), Guilherme Boulos (PSOL), Henrique Meirelles (MDB) e Ciro Gomes (PDT)";;;;"1027250649958936576";https://twitter.com/rd1oficial/status/1027250649958936576
GloboNews;2018-08-07 23:50;9;66;"GloboNews entrevista Henrique Meirelles , candidato do MDB à presidência: https:// glo.bo/2LZdSeX pic.twitter.com/7keul55352";;;;"1027024166992662536";https://twitter.com/GloboNews/status/1027024166992662536
pauloap;2018-08-06 23:10;568;2199;"SAIU A LISTA DOS CANDIDATOS CONFIRMADOS NO DEBATE DA BAND Jair Bolsonaro Marina Silva Ciro Gomes Geraldo Alckmin Henrique Meirelles Alvaro Dias Cabo Daciolo Guilherme Boulos é nesta quinta-feira agora, dia 09, 22h";;;;"1026651653783662592";https://twitter.com/pauloap/status/1026651653783662592
CaetanoBezerra;2018-08-06 21:12;2;7;"O PMDB inventar Henrique Meirelles candidato só pra ficar de butuca e se aliar com quem ganhar é a genialidade da pilantragem";;;;"1026621979728732162";https://twitter.com/CaetanoBezerra/status/1026621979728732162
BlogdoNoblat;2018-08-05 00:23;14;116;"Procura-se um candidato a presidente da República que se ofereça para dar continuidade à plataforma do governo Temer. Nem Henrique Meirelles , ministro da Fazenda de Temer até um dia desses, candidato dele mesmo e abrigado no PMDB, quer se prestar a esse papel.";;;;"1025945386480009216";https://twitter.com/BlogdoNoblat/status/1025945386480009216
rosaneoliveira;2018-08-04 09:59;13;63;"Henrique Meirelles confirma vinda a Porto Alegre amanhã para a convenção do MDB. Sinal de que Germano @rigotto será mesmo o vice.";;@rigotto;;"1025727902690750464";https://twitter.com/rosaneoliveira/status/1025727902690750464
EvelyneLessa;2018-08-04 00:18;13;85;"- Geraldo Alckmin e Ana Amélia. - Jair Bolsonaro e Janaína Paschoal. - Henrique Meirelles e Marta Suplicy. Com essas chapas candidatas à presidência, seja lá qual for o candidato do PT, voto de olho fechado. E você?";;;;"1025581777409269760";https://twitter.com/EvelyneLessa/status/1025581777409269760
Mari_Jurema;2018-08-03 22:06;8;8;"Já vai tarde, essa traidora! http:// elpais.com/Comentario/153 3332678-ff485e7875bf982da457dcad1be92d08 …";;;;"1025548501562863616";https://twitter.com/Mari_Jurema/status/1025548501562863616
sidneyrezende;2018-08-03 21:23;42;165;"Henrique Meirelles é um economista talentoso. Mas em outubro o eleitor julgará suas escolhas políticas. Uma delas foi abraçar Michel Temer. O mesmo que tem um patrimônio imobiliário que cresceu quase cinco vezes em vinte anos e chega a 33 milhões de reais. Pode isso, Arnaldo ?";;;;"1025537682477408257";https://twitter.com/sidneyrezende/status/1025537682477408257
maxvalenga;2018-08-09 21:28;0;0;"Henrique Meirelles kkkkkkkkkkkkkkkkkkkkkkkkkkkkkkkkkkkkkkkkkkkkkkkkk kkkkkkkkkkkkkkkkkkkkkkkkkkkkkkkkkkkkkkkkkkkkkkkkk kkkkkkkkkkkkkkkkkkkkkkkkkkkkkkkkkkkkkkkkkkkkkkkkk kkkkkkkkkkkkkkkkkkkkkkkkkkkkkkkkkkkkkkkkkkkkkkkkk kkkkkkkkkkkkkkkkkkkkkkkkkkkkkkkkkkkkkkkkkkkkkkkkk kkkkkkkkkkk";;;;"1027713279790075905";https://twitter.com/maxvalenga/status/1027713279790075905
viniciusvalfre;2018-08-09 21:20;0;0;"Buscas no Google nas últimas quatro horas, dia de #debatenaband , por Jair Bolsonaro, Geraldo Alckmin, Marina Silva e Henrique Meirelles . pic.twitter.com/FIyr0xWvXi";;;#debatenaband;"1027711292705042432";https://twitter.com/viniciusvalfre/status/1027711292705042432
revistavoto;2018-08-09 21:16;0;3;"Chega o candidato ao Planalto pelo MDB, Henrique Meirelles . #Tvbandnews #DebateBand pic.twitter.com/sEgle53ycV";;;#Tvbandnews #DebateBand;"1027710123471499266";https://twitter.com/revistavoto/status/1027710123471499266
diegodunga;2018-08-09 21:09;0;0;"Gosto do Henrique Meirelles , pelo trabalho que fez. Porém, não voto nele pelos amigos em volta que vai colocar quando virar presidente.";;;;"1027708506663780359";https://twitter.com/diegodunga/status/1027708506663780359
PistolandoPod;2018-08-09 21:09;0;0;"Beba uma dose pra cada vez que você sentir pena do papel de palhaço do Henrique Meirelles sendo boi de piranha pro MDB não dizer com todas as letras que Alckmin não passa de um Temer sabor chuchu";;;;"1027708485579010048";https://twitter.com/PistolandoPod/status/1027708485579010048
nivasouza;2018-08-09 21:09;0;0;"Henrique Meirelles chega pro #DebateBand com grande comitiva em carro de passeio e uma van. pic.twitter.com/rImlwMapbt";;;#DebateBand;"1027708379551199243";https://twitter.com/nivasouza/status/1027708379551199243
jujhufigueiredo;2018-08-09 21:08;0;0;"O Brasil se pergunta: o que fez Henrique Meirelles além de ter sido um merda de Ministro da Fazenda no governo golpista? #debatenaband";;;#debatenaband;"1027708278632005632";https://twitter.com/jujhufigueiredo/status/1027708278632005632
OsRevendo;2018-08-09 21:00;0;0;"Vamos conhecer os candidatos: 6o Henrique Meirelles - Companheiro do PT por anos #EstouComBolsonaro pic.twitter.com/iUB8DiAwWX";;;#EstouComBolsonaro;"1027706254662230018";https://twitter.com/OsRevendo/status/1027706254662230018
Tamagotchi25;2018-08-09 20:27;0;0;"Henrique Meirelles receberá toda a carga negativa e desgaste de ser o candidato do governo Temer, fora que aquela cara de banqueiro não empolga em nada.";;;;"1027697959310381057";https://twitter.com/Tamagotchi25/status/1027697959310381057
Soares_Nerd;2018-08-09 19:29;0;0;"ciro gomes, Henrique meirelles e Guilherme boulos um de cada ''tipo'', esquerda direita e talz vai do seu gosto, mas os 3 são competentes";;;;"1027683206903029760";https://twitter.com/Soares_Nerd/status/1027683206903029760
carvalho_rc;2018-08-09 19:18;0;1;"Lembrem: o Henrique Meirelles trabalha para eles. #BolsonaroEMourãoParaOBemDoBrasil";;;#BolsonaroEMour;"1027680655633784832";https://twitter.com/carvalho_rc/status/1027680655633784832
xtraga;2018-08-09 18:39;0;3;"Hoje rola o primeiro debate presidencial do ano, na Band, a partir das 22h. Estarão presentes Marina Silva, Ciro Gomes, Guilherme Boulos, Alvaro Dias, Cabo Daciolo, Geraldo Alckimin, Jair Bolsonaro e Henrique Meirelles . Ansiosos para ver muito dedo no cu e gritaria?";;;;"1027670734343217152";https://twitter.com/xtraga/status/1027670734343217152
cynaramenezes;2018-08-08 15:33;5;49;"de fato o henrique meirelles é fofo, hein? #SQN pic.twitter.com/rWBkDGXQy0";;;#SQN;"1027261488841588737";https://twitter.com/cynaramenezes/status/1027261488841588737
nadanovonofront;2018-08-08 12:13;5;16;"Continua: Guilherme Boulos (PSOL) 1,0 João Amoêdo (Novo) 0,8 Vera Lúcia (PSTU) 0,8 Henrique Meirelles (MDB) 0,7 Levy Fidelix (PRTB) 0,3 João Goulart Filho (PPL) 0,3 Eymael (DC) 0,1 Paulo Rabello de Castro (PSC) 0,1";;;;"1027211172821565441";https://twitter.com/nadanovonofront/status/1027211172821565441
OGloboPolitica;2018-08-06 10:17;8;5;"Henrique Meirelles desconversa sobre proteção a grupo de Temer, caso eleito. http:// glo.bo/2OihMfF pic.twitter.com/rKLxGcGUQm";;;;"1026457286334660609";https://twitter.com/OGloboPolitica/status/1026457286334660609
decademartori;2018-08-05 12:39;4;31;"Candidato à Presidência Henrique Meirelles chegou à convenção do MDB do Rio Grande do Sul para anunciar o ex-governador gaúcho Germano Rigotto como seu vice na chapa @GauchaZH pic.twitter.com/6mQZaYZDOI";;@GauchaZH;;"1026130656777187328";https://twitter.com/decademartori/status/1026130656777187328
bbecarvalho_;2018-08-05 12:04;4;5;"confirmados até agora para Presidente: Álvaro Dias Cabo Daciolo Ciro Gomes Geraldo Alckmin Guilherme Boulos Henrique Meirelles Jair Bolsonaro João Amoêdo José Maria Eymael Luiz Inácio Lula da Silva Manuela D' Ávila Marina Silva Vera Lúcia ESTUDEM sobre eles!!!!!!!";;;;"1026121744829046784";https://twitter.com/bbecarvalho_/status/1026121744829046784
_carlos_machado;2018-08-05 10:47;3;11;"Hoje à noite, no Jornal de Domingo, entrevista exclusiva com Henrique @meirelles , candidato do @MDB_Nacional à presidência da República. Gargalos na infraestrutura do RS, compensações da Lei Kandir e outros temas a partir das 22h. @RdGuaibaOficial #LigaNaGuaíba pic.twitter.com/1izQXIHGra";;@meirelles @MDB_Nacional @RdGuaibaOficial;#LigaNaGua;"1026102493544165376";https://twitter.com/_carlos_machado/status/1026102493544165376
abdalafarah;2018-08-03 00:06;205;900;"Candidatos e Vice Candidatos à Presidência: - Geraldo Alckmin e Ana Amélia. - Jair Bolsonaro e Janaína Paschoal. - Henrique Meirelles e Marta Suplicy. Motorista, vou descer na próxima parada, por favor!";;;;"1025216318235127808";https://twitter.com/abdalafarah/status/1025216318235127808
nivasouza;2018-08-09 21:13;0;0;"@cirogomes é o último presidenciável a chegar pro #DebateComLula . Ele se confundiu, seguindo pro lado errado até assessores correm atrás pra fazê-lo mudar de rota. Veio em van, assim como @MarinaSilva e Henrique Meirelles . pic.twitter.com/HNQf6PtsS2";;@cirogomes @MarinaSilva;#DebateComLula;"1027709403225628673";https://twitter.com/nivasouza/status/1027709403225628673
MetroJornal_SP;2018-08-09 21:11;1;3;"Candidato do MDB Henrique Meirelles acaba de chegar para o debate. "Minha meta é criar 10 milhões de empregos˜ #debateband #eleicoes2018 pic.twitter.com/yI5EoXDmVr";;;#debateband #eleicoes2018;"1027709075839221760";https://twitter.com/MetroJornal_SP/status/1027709075839221760
RBandeirantes;2018-08-09 21:09;0;3;"#AoVivo : o candidato Henrique Meirelles chega ao Grupo Bandeirantes de Comunicação. Acompanhe os preparativos do #DebateBand : http:// bit.ly/1oTRHlL #FocoEmVocê pic.twitter.com/NfjFm4MWmL";;;#AoVivo #DebateBand #FocoEmVoc;"1027708523285819392";https://twitter.com/RBandeirantes/status/1027708523285819392
petcafer;2018-08-09 20:29;0;1;"Ainda teremos Henrique Meirelles , o candidato do MDB que na verdade só existe para blindar Alckmin, o verdadeiro candidato do governo. Ciro pode fazer essa fala se tiver chance, enquanto os outros só vão relacioná-lo ao Temer. #DebateBand";;;#DebateBand;"1027698439562379264";https://twitter.com/petcafer/status/1027698439562379264
guimorce;2018-08-09 20:24;0;0;"(P)MDB lançou a candidatura do Henrique Meirelles só pra gastar dinheiro fazendo campanha pq nunca que ele tem chances de ir para o segundo turno.";;;;"1027697197884817409";https://twitter.com/guimorce/status/1027697197884817409
rd1oficial;2018-08-09 16:50;2;2;"Ainda sobre o #DebateBand . A Band colocou 6 credenciais/cadeiras na plateia à disposição do PT. É o mesmo número dos demais candidatos que participarão: Álvaro Dias, Cabo Daciolo, Geraldo Alckmin, Marina Silva, Jair Bolsonaro, Guilherme Boulos, Henrique Meirelles e Ciro Gomes.";;;#DebateBand;"1027643213140688896";https://twitter.com/rd1oficial/status/1027643213140688896
RadioBandNewsBH;2018-08-09 10:46;2;5;"Oito candidatos estarão frente a frente: Geraldo Alckmin, do PSDB; Jair Bolsonaro, do PSL; Marina Silva, da Rede; Ciro Gomes, do PDT, Álvaro Dias, do Podemos; Cabo Daciolo, do Patriota; Henrique Meirelles , do MDB; e Guilherme Boulos, do PSol.";;;;"1027551703669895169";https://twitter.com/RadioBandNewsBH/status/1027551703669895169
piperno;2018-08-08 22:51;2;17;"O Henrique Meirelles está mais ou menos como a dona Leila Crefisa. Coloca bastante dinheiro na campanha, mas o time não deslancha.";;;;"1027371665674723328";https://twitter.com/piperno/status/1027371665674723328
belinha_Inez;2018-08-07 13:44;0;7;"Precisa ser muito loser pra votar no Henrique Meirelles , cara...";;;;"1026871734962741248";https://twitter.com/belinha_Inez/status/1026871734962741248
nadanovonofront;2018-08-06 10:20;56;101;"Com a confirmação das chapas, vamos às candidaturas e coligações atuais: Lula/Haddad/Manuela D'Ávila - PT/PC do B/Pros/PCO Bolsonaro/General Mourão - PSL/PRTB Marina Silva/Eduardo Jorge - Rede/PV Ciro Gomes/Kátia Abreu - PDT/Avante Henrique Meirelles /Germano Rigotto - PMDB/PHS";;;;"1026458064214478849";https://twitter.com/nadanovonofront/status/1026458064214478849
Bibliothek2018;2018-08-05 21:20;1;17;"Até agora são três os candidatos a vice-presidente oriundos do Rio Grande do Sul: Hamilton Mourão (Jair Bolsonaro). Ana Amélia Lemos (Geraldo Alckmin). Germano Rigotto ( Henrique Meirelles ). Fenômeno interessante.";;;;"1026261817247649792";https://twitter.com/Bibliothek2018/status/1026261817247649792
mdbrs15;2018-08-04 17:22;5;17;"O ex-governador do Rio Grande do Sul, Germano Rigotto, foi oficializado como candidato a vice-presidente na chapa emedebista com Henrique Meirelles .";;;;"1025839500461830150";https://twitter.com/mdbrs15/status/1025839500461830150
cartamaior;2018-08-03 21:17;8;16;"Página 12 - Argentina - PÁGINA 12, Argentina - O candidato de um governo impopular: Henrique Meirelles . https:// bit.ly/2OIZPaP pic.twitter.com/A6mhv6l1ac";;;;"1025536191993708545";https://twitter.com/cartamaior/status/1025536191993708545
