username;date;retweets;favorites;text;geo;mentions;hashtags;id;permalink
deborista;2018-08-09 22:46;91;384;"gente eu pagaria qualquer valor pro alvaro dias olhar pra câmera e falar CARNE E UNHA ALMA GÊMEA BATEEE CORAÇÃOOO";;;;"1027732856058142720";https://twitter.com/deborista/status/1027732856058142720
naosoumario;2018-08-09 22:46;73;161;""o candidato Henrique Meirelles pergunta para o candidato Álvaro Dias " pic.twitter.com/M51Tp18jqq";;;;"1027732826169532417";https://twitter.com/naosoumario/status/1027732826169532417
seubrownie;2018-08-09 22:46;10669;28038;"devia ser proibido um candidato chato perguntar a outro candidato chato alvaro dias : quero perguntar para henrique meirelles mediador: infelizmente não pode, pois ambos são chatos. selecione um candidato do rol de doidos.";;;;"1027732804820525056";https://twitter.com/seubrownie/status/1027732804820525056
nadanovonofront;2018-08-09 22:46;165;368;"Álvaro Dias x Henrique Meirelles é o Panamá x Tunísia desse debate";;;;"1027732781550526464";https://twitter.com/nadanovonofront/status/1027732781550526464
glaubermacario;2018-08-09 22:45;733;1495;"Meirelles pergunta para Alvaro Dias que tem o pet mais fofinho. #DebateBand pic.twitter.com/aXTQtvFbW4";;;#DebateBand;"1027732747354300416";https://twitter.com/glaubermacario/status/1027732747354300416
leticiaaraujoa_;2018-08-09 23:19;16;61;""Minha pergunta é pro Meireles com comentários do Álvaro Dias " Meu Deus me dê paciência pra ouvir esses dois #DebateBand pic.twitter.com/oEWy1wQILX";;;#DebateBand;"1027741194087006208";https://twitter.com/leticiaaraujoa_/status/1027741194087006208
pvictorrc;2018-08-09 22:49;11;18;"Tá vendo esse semblante do Alvaro Dias ? Pois é, é exatamente assim que eu fico depois da décima lata de cerveja. #DebateBand";;;#DebateBand;"1027733602166034432";https://twitter.com/pvictorrc/status/1027733602166034432