username;date;retweets;favorites;text;geo;mentions;hashtags;id;permalink
ferreiragbr;2018-08-01 23:38;47;451;"Tô chocado, realmente Ciro Gomes é un candidato bem surpreendente #CiroNaGloboNews";;;#CiroNaGloboNews;"1024846879744507905";https://twitter.com/ferreiragbr/status/1024846879744507905
kkverone;2018-08-01 23:38;35;285;"Melhor candidato disparado!!!! Pode entrar Ciro Gomes !! Que satisfação ouvir esse cara! #CiroNaGloboNews #CiroGomes";;;#CiroNaGloboNews #CiroGomes;"1024846761477763074";https://twitter.com/kkverone/status/1024846761477763074
Matheusdes;2018-08-01 23:35;83;669;"Eu tô assombrado com o tamanho do preparo do Ciro Gomes #CiroNaGloboNews";;;#CiroNaGloboNews;"1024846109376688128";https://twitter.com/Matheusdes/status/1024846109376688128
Bob_Fernandes;2018-08-01 23:32;910;4703;"Assistindo Ciro Gomes expor e debater ideias -sim, ele tem ideias próprias- em entrevista na Globo News e tendo assistido Bolsonaro no Roda Viva inescapável uma conclusão: há um universo há separá-los.";;;;"1024845283631554560";https://twitter.com/Bob_Fernandes/status/1024845283631554560
eduardodelduca;2018-08-01 23:25;46;327;"Ciro Gomes na economia da show, ele sem dúvida é o mais preparado. #GNEleicoes2018 #CiroNaGloboNews";;;#GNEleicoes2018 #CiroNaGloboNews;"1024843646078791680";https://twitter.com/eduardodelduca/status/1024843646078791680
domm_quixote;2018-08-01 23:22;147;691;""Esse país é um país saqueado e a gente sabe quem tá saqueando". Ciro Gomes sobre os lucros com juros exorbitantes dos bancos enquanto temos 13 milhões de desempregados. #CiroNaGlobonews";;;#CiroNaGlobonews;"1024842821642199041";https://twitter.com/domm_quixote/status/1024842821642199041
malumolinasp;2018-08-01 23:19;72;457;"Ciro Gomes firme e contundente nas respostas, demonstrando sua grande preocupação e compromisso com o futuro do país. #CiroNaGloboNews";;;#CiroNaGloboNews;"1024841966570426368";https://twitter.com/malumolinasp/status/1024841966570426368
adrianotomasoni;2018-08-01 23:16;131;518;"Ciro Gomes enrola enrola mas na verdade o que ele quer é ser um ditador nesse país. Ele é o perigo pra venezualizaçao desse país.";;;;"1024841410598580224";https://twitter.com/adrianotomasoni/status/1024841410598580224
_caldeiralucas;2018-08-01 23:14;1083;4343;"- Miriam Leitão:Você acha que isso (a fama de estourado) pode te prejudicar? - Ciro Gomes : Sim, já está, porque estamos falando disso ao invés de discutir o desemprego do povo. pic.twitter.com/uSi5dlFkzd";;;;"1024840812717387776";https://twitter.com/_caldeiralucas/status/1024840812717387776
cila_schulman;2018-08-01 23:32;411;2032;"Você pode até não concordar com as ideias, mas uma certeza pode ter sobre Ciro Gomes : ele não irá ao Posto Ipiranga perguntar sobre economia.";;;;"1024845425944285184";https://twitter.com/cila_schulman/status/1024845425944285184
oimperador;2018-08-01 23:13;237;1119;"“To ficando irônico mas não quero ficar não”. O Ciro Gomes é o usuário do Twitter que chegou lá.";;;;"1024840591694282752";https://twitter.com/oimperador/status/1024840591694282752