username;date;retweets;favorites;text;geo;mentions;hashtags;id;permalink
felipeelemos;2018-08-09 12:50;14;14;"Hoje tem Ciro na Band! #DebateBand #CironaBand #CiroPresidente12 #Ciro2018 #Eleicoes2018 #ciro #PDT2018 @cirogomes @VemPraMassa @CiraoCarioca @TeamCiroGomes @CirogomesPE @CPreparado @CiroNeles @ehoradociro @todoscomciro";;@cirogomes @VemPraMassa @CiraoCarioca @TeamCiroGomes @CirogomesPE @CPreparado @CiroNeles @ehoradociro @todoscomciro;#DebateBand #CironaBand #CiroPresidente12 #Ciro2018 #Eleicoes2018 #ciro #PDT2018;"1027583002187112449";https://twitter.com/felipeelemos/status/1027583002187112449
mouraleo;2018-08-09 12:48;13;16;"Os minions estão compartilhando um trecho da sabatina do @cirogomes no BTG Pactual narrando o desempenho do Bolsie como se o Ciro estivesse elogiando o Bolsie e declarando voto nele... patéticos #cironaband #ciropresidente12";;@cirogomes;#cironaband #ciropresidente12;"1027582365609197569";https://twitter.com/mouraleo/status/1027582365609197569
JeffersonCiro12;2018-08-09 10:35;11;22;"Chegou o dia hoje tem #CiroNaBand o candidato de maior capacidade intelectual e moral para fazer o Brasil novamente trilhar o caminho do desenvolvimento.Vamos juntos com força e fé! Eleger #CiroPresidente12 #DebateBand #BrasilComCiro #CiroGomes pic.twitter.com/ISW0ffnCFQ";;;#CiroNaBand #CiroPresidente12 #DebateBand #BrasilComCiro #CiroGomes;"1027548934112272384";https://twitter.com/JeffersonCiro12/status/1027548934112272384
SnapBolsonaro;2018-08-09 10:33;303;790;"ATÉ O CIRO GOMES VAI VOTAR EM @jairbolsonaro . - Repelido pelos corruptos do Centrão e abandonado pelos comunistas do PT, Ciro Gomes vota 17 - Bolsonaro pic.twitter.com/IRhIUkhybm";;@jairbolsonaro;;"1027548519534678016";https://twitter.com/SnapBolsonaro/status/1027548519534678016
ThePCSantos;2018-08-09 10:18;3;13;"@cirogomes Não entre no jogo das provocações! Apresente seu plano de governo que vc, com certeza, irá se sobressair! #CiroPresidente12";;@cirogomes;#CiroPresidente12;"1027544668333072384";https://twitter.com/ThePCSantos/status/1027544668333072384
jefer234;2018-08-08 23:56;41;160;"EU SÓ QUERO VER A QUEM O RETARDADO DO @jairbolsonaro VAI APOIAR NO SEGUNDO TURNO! CIRO GOMES OU ALKIMIN? POVÃO VAI CONHECER DE FATO QUEM É ESSE VIRA FOLHA OPORTUNISTA... APOSTO QUE SERÁ CIRO GOMES ! DESEQUILIBRADO E LOUCO COMO ELE MESMO !!!";;@jairbolsonaro;;"1027388190477479937";https://twitter.com/jefer234/status/1027388190477479937
joaocarloxls;2018-08-07 19:15;17;53;"É @cirogomes porque ele não é uma peça colocada no jogo de repente. Ciro Gomes é uma construção do Brasil. Ciro Gomes é um Estadista. Ciro Gomes é da Massa. #CiroPresidente12";;@cirogomes;#CiroPresidente12;"1026954971546378241";https://twitter.com/joaocarloxls/status/1026954971546378241
GilbertoNoroes_;2018-08-07 18:27;53;149;"Ciro Gomes é o único político brasileiro que RECUSOU receber 3 aposentadorias que teria direito. Somadas chegariam ao valor de aproximadamente R$ 80 mil reais/mês. Esse é um dos motivos pelos quais eu quero #CiroPresidente12 #CiroPresidente2018 #CiroGomes";;;#CiroPresidente12 #CiroPresidente2018 #CiroGomes;"1026942842156081152";https://twitter.com/GilbertoNoroes_/status/1026942842156081152
SeuOurives;2018-08-07 16:42;148;480;"ATENÇÃO! - Foram definidos os vices: Bolsonaro - Gen. Mourão Ciro Gomes - Kátia Abreu Álvaro Dias - Rabello Alckmin - Ana Amélia Marina - Eduardo Lula - Haddad América-MG - Inter";;;;"1026916576799404033";https://twitter.com/SeuOurives/status/1026916576799404033
kolllontai;2018-08-06 00:45;250;893;"muito interessante a estratégia do ciro gomes de chamar o satanás em pessoa pra ser seu vice e afastar definitivamente a esquerda que tava inclinada pra votar nele";;;;"1026313222524231680";https://twitter.com/kolllontai/status/1026313222524231680
BolsonaroMourao;2018-08-05 14:32;97;147;"O cangaceiro Vagabundo, vulgarmente conhecido como SARDINHA ( @cirogomes ), não passa de um marginal de terno e gravata... A pessoa tem que detestar muito seu país pra dar seu voto a uma imundície dessa! pic.twitter.com/KBC9QEHbHg";;@cirogomes;;"1026159082393096192";https://twitter.com/BolsonaroMourao/status/1026159082393096192
fabiocamposm;2018-08-05 13:23;0;0;"Frankenstein. https://www. focus.jor.br/eleicoes2018/l ula-la-e-camilo-ca-ciro-gomes-fica-aonde-neste-dueto/ …";;;;"1026141666531581953";https://twitter.com/fabiocamposm/status/1026141666531581953
FocusJor;2018-08-05 13:23;0;0;"Frakenstein. https://www. focus.jor.br/eleicoes2018/l ula-la-e-camilo-ca-ciro-gomes-fica-aonde-neste-dueto/ …";;;;"1026141554661052416";https://twitter.com/FocusJor/status/1026141554661052416
Clauwild1;2018-08-05 09:27;2411;6700;"Quer a ‘democracia’chinesa,vote Ciro Gomes .Quer o crime no comando,vote Lula.Quer tirar merenda de crianças,vote Alckmin.Quer invadir propriedades,vote Boulos.Quer uma ecopetista,vote Marina.Quer o Brasil mais socialista,vote PCdoB.Quer acabar com a porcaria acima,vote Bolsonaro.";;;;"1026082350235574277";https://twitter.com/Clauwild1/status/1026082350235574277
vinicius_edipo;2018-08-09 09:09;36;73;"Concordo! Vamos usar o hashtag #CiroNaBand e estourar o Twitter pic.twitter.com/hXgoPPZeZ2";;;#CiroNaBand;"1027527376958365696";https://twitter.com/vinicius_edipo/status/1027527376958365696
nohaohc;2018-08-09 07:15;4;5;"Bora, Cirão. #CiroNaBand";;;#CiroNaBand;"1027498549142061056";https://twitter.com/nohaohc/status/1027498549142061056
judsonline;2018-08-08 22:54;7;16;"Atenção "pessoas de bem" do Brasil com suas mentiras tal qual aos demônios que servem: CIRO GOMES @cirogomes NÃO É E NUNCA FOI O SARDINHA DA PLANILHA DA ODEBRECHT! Matéria do @JornalOGlobo • https:// m.oglobo.globo.com/brasil/veja-os -novos-apelidos-revelados-pela-odebrecht-21852287 … #Fake #FakeNews #FatoOuFake #CiroPresidente12 #Ciro2018 pic.twitter.com/J9sSq0uWik";;@cirogomes @JornalOGlobo;#Fake #FakeNews #FatoOuFake #CiroPresidente12 #Ciro2018;"1027372502350290944";https://twitter.com/judsonline/status/1027372502350290944
CrisMenshova;2018-08-08 22:34;43;267;"Incrível como não falam a verdade! Isso é FakeNews, não acreditem! Com a internet o poder de manipular a opinião das pessoas acabou. Procurem saber a verdade dos fatos e não sejam enganados! Isso está fora do contexto!";;;;"1027367466119454721";https://twitter.com/CrisMenshova/status/1027367466119454721
luizinvintetres;2018-08-08 22:18;34;78;"* ciro gomes presidente chega pro ministro da fazenda* ciro: então seu froxo quanto é que tá dando de superávit aí ministro: 1... * ciro gomes se mata* *no enterro do ciro gomes * ministro: bilhão... curta se vc acha q vai dar bilhão";;;;"1027363345060573187";https://twitter.com/luizinvintetres/status/1027363345060573187
Ciro2018;2018-08-08 15:12;94;300;"Ciro Gomes : preparo, experiência e amor pic.twitter.com/wm4gLaS4C4";;;;"1027256274587660288";https://twitter.com/Ciro2018/status/1027256274587660288
CastroLuanna;2018-08-08 09:56;31;95;"Ciro Gomes é alvo de bolsominions e petistas. A inteligência e a integridade incomodam MUITO! Um ícone de verdade faz assim!";;;;"1027176809778110465";https://twitter.com/CastroLuanna/status/1027176809778110465
DebateJR;2018-08-07 21:28;396;366;"VOTE PRESIDENTE 2018 !!! @jairbolsonaro @LulaOficial @cirogomes @geraldoalckmin";;@jairbolsonaro @LulaOficial @cirogomes @geraldoalckmin;;"1026988600624377856";https://twitter.com/DebateJR/status/1026988600624377856
lgambim;2018-08-07 09:43;77;194;"Podiam fazer um jogo de luta das eleições. Os especiais seriam: Lula - cai um triplex em cima do inimigo Bolsonaro - chama Paulo Guedes Boulos - faz o inimigo ouvir uma palestra inteira Ciro Gomes - dá um tapa na orelha do inimigo Marina - some Alckimin - joga merenda no inimigo";;;;"1026811123419500544";https://twitter.com/lgambim/status/1026811123419500544
alves_heverson;2018-08-07 08:39;96;183;"PENSAMENTO DO DIA: meirelles = foi ministro de lula ciro gomes = foi ministro de lula marina silva = foi ministra de lula Haddad = foi mininstro de lula Lula = preso.";;;;"1026795085378281473";https://twitter.com/alves_heverson/status/1026795085378281473
CiroGomesRN;2018-08-06 22:32;60;145;"Projeto Nacional de Desenvolvimento do @CiroGomes : - Agronegócio - Construção civil - Complexo Industrial de Defesa - Complexo Industrial de Petróleo e Gás - Complexo Industrial da Saúde - Auditoria da Dívida Pública #CiroPresidente12";;@CiroGomes;#CiroPresidente12;"1026642080318279686";https://twitter.com/CiroGomesRN/status/1026642080318279686
ClarinhaPardini;2018-08-06 21:40;54;163;"" Ciro Gomes com mais de 80 processos judiciais nas costas" Judiciário que me perdoe, mas eu vou ter que concordar com o cirão pic.twitter.com/jq9CpWLyXA";;;;"1026629039346397184";https://twitter.com/ClarinhaPardini/status/1026629039346397184
crncosta;2018-08-06 17:46;163;474;"Saiu a divisão oficial: 5m32s - Alckmin 2m08s - Haddad 0m40s - Ciro Gomes 0m40s - Álvaro Dias 0m21s - Marina 0m09s - Bolsonaro";;;;"1026570199720517633";https://twitter.com/crncosta/status/1026570199720517633
mateuscgs;2018-08-06 17:21;174;831;"Todo Dia Um Petista Delusional Na Timeline Criticando O Ciro Gomes Por Fazer As Mesmas Alianças Pragmáticas que O PT Fez No Passado Produções Artísticas LTDA";;;;"1026563900664369159";https://twitter.com/mateuscgs/status/1026563900664369159
eduguim;2018-08-05 20:15;277;801;"O problema do nosso caro Ciro Gomes é que ele quer, "apenas", que o PT jogue Lula fora e embarque em seu projeto. Apesar da força eleitoral gigantesca do ex-presidente. E depois é o PT que está numa viagem de ácido lisérgico";;;;"1026245451190857729";https://twitter.com/eduguim/status/1026245451190857729
fuckinmadhatter;2018-08-05 14:03;222;891;"CIRO GOMES E KATIA ABREU: VOCÊ VIU ANTES (EM 2016) NO PERFIL FUCKINMADHATTER pic.twitter.com/nGjTlVWIp5";;;;"1026151674925273088";https://twitter.com/fuckinmadhatter/status/1026151674925273088
Giovann05925626;2018-08-04 19:02;38;206;"Vamos unir o Brasil!! @cirogomes pic.twitter.com/KDZOsso1Bz";;@cirogomes;;"1025864494340292608";https://twitter.com/Giovann05925626/status/1025864494340292608
MemesLgbt;2018-08-04 18:46;28;178;"Ciro Gomes nos braços da Massa em Minas Gerais. #CiroNaGloboNews #CiroGomes #MulheresComCiro #LgbtsComCiro pic.twitter.com/6BYqFBPEiy";;;#CiroNaGloboNews #CiroGomes #MulheresComCiro #LgbtsComCiro;"1025860566353629184";https://twitter.com/MemesLgbt/status/1025860566353629184
wallyssonrg;2018-08-04 16:20;0;8;"Quer mamar, ein?";;;;"1025823717153271810";https://twitter.com/wallyssonrg/status/1025823717153271810
DebateJR;2018-08-04 13:20;246;225;"VOTE PRESIDENTE 2018 !!! #LULA #BOLSONARO #CIROGOMES #AlvaroDias";;;#LULA #BOLSONARO #CIROGOMES #AlvaroDias;"1025778482587099138";https://twitter.com/DebateJR/status/1025778482587099138
Ramonmbc;2018-08-06 15:06;9;32;"#CiroNaCBIC O farol na noite escura... Ciro Gomes 12 @cirogomes @todoscomciro #CiroPresidente #Ciro2018 #todoscomciro #ciropresi pic.twitter.com/pspYf7TIVk";;@cirogomes @todoscomciro;#CiroNaCBIC #CiroPresidente #Ciro2018 #todoscomciro #ciropresi;"1026530021719126016";https://twitter.com/Ramonmbc/status/1026530021719126016
edugoldenberg;2018-08-06 07:02;77;678;"Meu voto será para @LulaOficial , @Haddad_Fernando e @ManuelaDavila - seja qual for o desenho da chapa. Mas as críticas ao @cirogomes pela escolha da @KatiaAbreu são patéticas. Quem escolheu bem o vice? O @ptbrasil de @dilmabr em 2014 com @MichelTemer ?! Melhorem, por favor.";;@LulaOficial @Haddad_Fernando @ManuelaDavila @cirogomes @KatiaAbreu @ptbrasil @dilmabr @MichelTemer;;"1026408077891960833";https://twitter.com/edugoldenberg/status/1026408077891960833
PescotapaDiario;2018-08-06 01:31;1770;6175;"Haddad é uma palavra em aramaico que significa ciro gomes é o caralho.";;;;"1026324908203302912";https://twitter.com/PescotapaDiario/status/1026324908203302912
Ro_Moller;2018-08-06 00:07;177;756;"Chapa Lula/Haddad vai perder para Ciro Gomes e Alckmin/E alguém do Centrão vai perder para Marina Silva e quanto a Bolsonaro, boas chances de vencer no primeiro turno, ficou claro especialistas do #CanalLivre !?";;;#CanalLivre;"1026303798132658176";https://twitter.com/Ro_Moller/status/1026303798132658176
amilcarebr;2018-08-05 23:05;11;55;"Resolvi apoiar o @cirogomes à presidência do Brasil porque ele é o único que eu consegui ver que comprende a real situação do país e o que é necessário para mudar, curto, medio e longo prazo, sem prejudicar as classes que já são prejudicadas há muito tempo: a classe trabalhadora.";;@cirogomes;;"1026288118905954304";https://twitter.com/amilcarebr/status/1026288118905954304
2007Rosedias;2018-08-05 22:43;14;33;"Algumas manifestações de apoio, em nosso grupo do face ( Ciro Gomes Presidente em 2018)... @cirogomes #Ciro12 #CiroPresidente pic.twitter.com/HuxDcWyHq3";;@cirogomes;#Ciro12 #CiroPresidente;"1026282546571685888";https://twitter.com/2007Rosedias/status/1026282546571685888
ricardope;2018-08-05 15:24;86;230;"Anunciando um vice de seu próprio partido, Ciro Gomes enterra qualquer possibilidade de unidade no primeiro turno. Seu projeto pessoal de poder falou mais alto; quem culpava o PT por não querer a unidade viu que a culpa nunca foi do PT, mas da arrogância do "coroné".";;;;"1026172000543428608";https://twitter.com/ricardope/status/1026172000543428608
JenioQuadros;2018-08-05 14:41;186;631;"A chapa Ciro Gomes e Kátia Abreu ou melhor a chapa "Eu xingo todo mundo e você joga o vinho na cara"";;;;"1026161359602503680";https://twitter.com/JenioQuadros/status/1026161359602503680
jaynereis;2018-08-05 12:58;10;52;"Para o Brasil só existe uma Saída Ciro Gomes Presidente #Ciro #PSBCOMCiro";;;#Ciro #PSBCOMCiro;"1026135350173999104";https://twitter.com/jaynereis/status/1026135350173999104
armini89;2018-08-05 12:19;12;79;"Após assistir a sabatina no @GloboNews puder perceber que @cirogomes PRA MIM é um dos melhores candidatos a presidência.";;@GloboNews @cirogomes;;"1026125647410851840";https://twitter.com/armini89/status/1026125647410851840
Jo_elson_;2018-08-04 23:09;30;113;"#PSBComCiro é a hora de nos unirmos contra Temer e seu candidato disfarçado nas máscaras tucanas. Também é hora de nos unirmos contra o despreparo e o amadorismo de um candidato representante do fascismo. Ciro Gomes é o único com reais chances de vencer isto tudo.";;;#PSBComCiro;"1025926634002698241";https://twitter.com/Jo_elson_/status/1025926634002698241
Rivotripa;2018-08-04 14:30;55;289;"Ciro Gomes na Globo News: "vou tirar os 63 milhões de brasileiros do SPC". Opinião do artista @Leoni_a_jato : pic.twitter.com/4CsHk7FYUW";;@Leoni_a_jato;;"1025796185309802507";https://twitter.com/Rivotripa/status/1025796185309802507
W_Almeida92;2018-08-04 10:38;46;185;"POLÍTICOS E SUAS FRASES CIRO GOMES Falta pouco para o dia que os bandidos vão passar a mão na polícia JEAN WYLLYS Fui salvo pela educação LULA Não existe uma viva alma mais honesta que eu DILMA Estou saudando a mandioca BOLSONARO Brasil acima de tudo, Deus acima de todos";;;;"1025737644762910720";https://twitter.com/W_Almeida92/status/1025737644762910720
Carla01000;2018-08-04 02:54;12;88;"Tô com Ciro Gomes pra presidente. Me conquistou. #CiroNaGloboNews #CiroPresidente #Ciro2018";;;#CiroNaGloboNews #CiroPresidente #Ciro2018;"1025621046412632064";https://twitter.com/Carla01000/status/1025621046412632064
SnapBolsonaro;2018-08-04 02:42;537;1952;"Acho que depois de hoje, as pesquisas ficaram assim: - Jair Bolsonaro: 177% - Geraldo Alckmin: -15% - Ciro Gomes : Tá gritando com alguém - Marina Silva: Virou uma planta.";;;;"1025617989859717120";https://twitter.com/SnapBolsonaro/status/1025617989859717120
MarioAvelino12;2018-08-04 00:22;20;126;"Marina uma banana. Bolsonaro um louco. Geraldo um corrupto. Lula um presidiário. O mais preparado Ciro gomes";;;;"1025582824915722240";https://twitter.com/MarioAvelino12/status/1025582824915722240
marilianevesv;2018-08-04 00:06;197;935;"EU estou vivendo pelo encontro de Ciro Gomes e esse doido aí";;;;"1025578633493204992";https://twitter.com/marilianevesv/status/1025578633493204992
RafaelPereira_S;2018-08-03 23:35;298;1047;"Há apenas dois dias atrás o Coroné Ciro Gomes disse que iria tirar 63 milhões de pessoas do SPC e NENHUM desses jornaleiros especialistas em economia perguntou como ele iria fazer #BolsonaroNaGloboNews";;;#BolsonaroNaGloboNews;"1025570791625244672";https://twitter.com/RafaelPereira_S/status/1025570791625244672
_rafajihrane;2018-08-03 23:20;15;81;"ansiosa pelo debate entre ********* x ciro gomes meu candidato vai jantar o consagrado pra cima @cirogomes";;@cirogomes;;"1025567018920169472";https://twitter.com/_rafajihrane/status/1025567018920169472
PauloSGM;2018-08-03 23:05;17;75;"O abismo intelectual entre Bolsonaro e Ciro Gomes salta aos olhos. Exceto pra aqueles que militam cegamente pro "mito" de Taubaté.";;;;"1025563280327278592";https://twitter.com/PauloSGM/status/1025563280327278592
ricardope;2018-08-04 11:22;66;133;"Desde que se lançou candidato Ciro Gomes não fez outra coisa que tentar implodir qualquer unidade da esquerda que não tivesse seu nome na cabeça de chapa embora não saia dos 4%. Como última cartada escreve artigo em que ofende mais uma vez o PT. Sua arrogância é seu pior inimigo";;;;"1025748810268585985";https://twitter.com/ricardope/status/1025748810268585985
brunomassa;2018-08-04 01:13;76;528;"Depois de assistir entrevistas de Jair Bolsonaro, Marina Silva, Ciro Gomes , Guilherme Boulos, Manuela D'Avila e João Amoedo, cheguei a conclusão de que: O BRASIL TÁ FUDIDO.";;;;"1025595641622405120";https://twitter.com/brunomassa/status/1025595641622405120
rafaelfrndx;2018-08-04 00:20;6;46;"ciro gomes meu presidente. bolsonaro lixo babaca";;;;"1025582228946993153";https://twitter.com/rafaelfrndx/status/1025582228946993153
henriolliveira;2018-08-04 00:07;111;290;"HÁ DOIS DIAS ATRÁS, CIRO GOMES disse que iria simplesmente TIRAR O NOME DE 60 MILHÕES DE PESSOAS DO SPC. NENHUM jornalista pediu a "fórmula econômica mágica" que seria utilizada! #BolsonaroNaGloboNews";;;#BolsonaroNaGloboNews;"1025578966558617600";https://twitter.com/henriolliveira/status/1025578966558617600
JeffersonSR10;2018-08-03 23:44;73;842;""Há apenas dois dias atrás o Coroné Ciro Gomes disse que iria tirar 63 milhões de pessoas do SPC e NENHUM desses jornaleiros especialistas em economia perguntou como ele iria fazer" #BolsonaroNaGloboNews";;;#BolsonaroNaGloboNews;"1025573258953932800";https://twitter.com/JeffersonSR10/status/1025573258953932800
bellopaiol;2018-08-03 23:15;19;57;"gente quem viu o ciro gomes e ta vendo o candidato hoje percebeu o universo entre eles né?";;;;"1025565900693491715";https://twitter.com/bellopaiol/status/1025565900693491715
republica_ctba;2018-08-03 20:19;37;51;"Irmão de Ciro Gomes tem 15 dias para explicar suspeitas na licitação do metrô de Fortaleza https:// republicadecuritiba.net/2018/08/03/irm ao-de-ciro-gomes-tem-15-dias-para-explicar-suspeitas-na-licitacao-do-metro-de-fortaleza/ … pic.twitter.com/iL7J7bDVhw";;;;"1025521457516961792";https://twitter.com/republica_ctba/status/1025521457516961792
soldier_182;2018-08-03 18:16;0;1;"HEUHEUHDUEH";;;;"1025490682696425472";https://twitter.com/soldier_182/status/1025490682696425472
cirogomes;2018-08-03 17:52;468;2099;"Muita calma nessa hora! Ciro Gomes https://www. portalcirogomes.com.br/noticias/muita -calma-nessa-hora/ …";;;;"1025484458697412608";https://twitter.com/cirogomes/status/1025484458697412608
MemesLgbt;2018-08-03 17:44;7;19;"Eu quero Ciência e tecnologia Educação Saúde Segurança Economia Eu quero @cirogomes presidente para um BRASIL Decente. #CiroGomes";;@cirogomes;#CiroGomes;"1025482542605115392";https://twitter.com/MemesLgbt/status/1025482542605115392
damassena;2018-08-03 14:53;30;140;"Já fui petista, filho de um petista que deu seu sangue por Lula, hoje estou com #CiroGomes e não abro. Depois que o PT puxou o tapete do Ciro Gomes mais uma vez, posso dizer claramente. O PT é o partido mais traidor do Brasil, bando de covardes assim como o PSB, que já gostei";;;#CiroGomes;"1025439417673154560";https://twitter.com/damassena/status/1025439417673154560
edinhomiranda;2018-08-03 14:27;71;76;"Em qual deles você não votaria de forma alguma? @jairbolsonaro @cirogomes @geraldoalckmin @MichelTemer @MarinaSilva @PatyMancilha @mesquitalex @roxmo @lobaoeletrico @kibeloco";;@jairbolsonaro @cirogomes @geraldoalckmin @MichelTemer @MarinaSilva @PatyMancilha @mesquitalex @roxmo @lobaoeletrico @kibeloco;;"1025433050329636866";https://twitter.com/edinhomiranda/status/1025433050329636866
ciraoantifa;2018-08-03 10:38;13;27;"O @ptbrasil perdeu o senso. Só quer poder e tentou fragilizar e destruir a candidatura de @cirogomes . Agora está pagando caro. Perdendo apoiadores. #CiroGomes #PT #Lula #Ciro2018 pic.twitter.com/qgprYu0hOk";;@ptbrasil @cirogomes;#CiroGomes #PT #Lula #Ciro2018;"1025375387839340545";https://twitter.com/ciraoantifa/status/1025375387839340545
craudas;2018-08-03 10:22;15;143;"Decidido. Vou votar no Ciro Gomes !";;;;"1025371252867964928";https://twitter.com/craudas/status/1025371252867964928
OCorvo_;2018-08-03 09:03;30;226;"" Ciro Gomes tem esse tipo de valentia, que é insultar as pessoas guardando uma prudente distância física em relação as suas vítimas" - Aloysio Nunes Ferreira-";;;;"1025351506353184768";https://twitter.com/OCorvo_/status/1025351506353184768
Giovann05925626;2018-08-03 07:01;27;96;"Ao seu lado estamos!!!!! Bom dia!!!! @cirogomes pic.twitter.com/Ja1WKZH40v";;@cirogomes;;"1025320726943989760";https://twitter.com/Giovann05925626/status/1025320726943989760
franciscomacsoa;2018-08-02 21:37;150;343;"E tem gente que fala ainda que @cirogomes é inteligente kkkkk Quanta asneira .... Bolsonaro 2018 #BolsonaroLiveHoje pic.twitter.com/RZ4kfYkkhS";;@cirogomes;#BolsonaroLiveHoje;"1025178743894102016";https://twitter.com/franciscomacsoa/status/1025178743894102016
SchuldinerSieg;2018-08-02 18:57;38;380;"Repararam que ninguém mais comenta do @cirogomes ? Tá mais morto do que vida sexual de Feminista.";;@cirogomes;;"1025138670670684161";https://twitter.com/SchuldinerSieg/status/1025138670670684161
DebateJR;2018-08-02 18:40;299;257;"POR QUE LULA FOI PRESO ??? @LulaOficial @Enquette_ @diImabr @dilmabr @cirogomes @jairbolsonaro";;@LulaOficial @Enquette_ @diImabr @dilmabr @cirogomes @jairbolsonaro;;"1025134390102437893";https://twitter.com/DebateJR/status/1025134390102437893
SchuldinerSieg;2018-08-02 14:32;103;530;"A Janaína Paschoal elogiar o Ciro Gomes é a mesma coisa de você dar um abraço num cara que passou a mão na bunda da tua mulher. Inaceitável. #DireitaUnida";;;#DireitaUnida;"1025071913469652993";https://twitter.com/SchuldinerSieg/status/1025071913469652993
Leoni_a_jato;2018-08-02 00:48;361;2182;"Ciro Gomes , hoje na entrevista da Globonews, demonstrou um preparo tão infinitamente maior que o do candidato armamentista, que este deveria retirar sua candidatura por conta da humilhação a que se submete na comparação.";;;;"1024864539827990529";https://twitter.com/Leoni_a_jato/status/1024864539827990529
Rolandinho;2018-08-02 00:44;215;2472;"Já vou deixar público: meu voto é do Ciro Gomes . Já admiro ele de longa data e será um prazer votar em alguém tão bem preparado. @cirogomes";;@cirogomes;;"1024863373530484737";https://twitter.com/Rolandinho/status/1024863373530484737
castellargalaum;2018-08-02 00:21;53;244;""Do pcc só tem dois presos fora do estado de São Paulo, isso pq o PCC concordou... " Ciro Gomes Miriam Leitão: vamos falar aqui do Neymar rapidinho #CiroNaGloboNews";;;#CiroNaGloboNews;"1024857601950081024";https://twitter.com/castellargalaum/status/1024857601950081024
iamwanderson;2018-08-02 00:21;117;527;"Sobre o aumento da mortalidade infantil, comparativo de respostas: Ciro Gomes : "Nós estamos passando por um subfinanciamento dramático nas ações básicas de saúde..." Bolsonaro: "Tem que tratar a cárie da gestante..." #CiroNaGlobonews";;;#CiroNaGlobonews;"1024857592731000833";https://twitter.com/iamwanderson/status/1024857592731000833
Brubs_PH;2018-08-02 00:15;83;589;"Ciro Gomes falando sobre mortalidade infantil deixa bem evidente o quão inteligente é, citando dados, e como é possivel soluciona-la. #CiroNaGloboNews";;;#CiroNaGloboNews;"1024856140939780099";https://twitter.com/Brubs_PH/status/1024856140939780099
clitfloresta;2018-08-02 00:11;60;144;"Ciro Gomes falou: "a cúpula do PCC está presa em São Paulo e não em presídio federal por acordos da faccao com autoridades estaduais" - Merval perdeu a linha FEIO e levou outra invertida. Miriam Leitão: "eeeeeeh ... Vamo mudar de assunto?"";;;;"1024855124961882113";https://twitter.com/clitfloresta/status/1024855124961882113
chicobarney;2018-08-01 23:58;707;2950;"Hahahhhahahuhdasal;fk Ciro Gomes falou do acordo do governo de SP com o PCC Logo soou o Alerta de Mudança de Assunto da Miriam Leitão";;;;"1024851919733444608";https://twitter.com/chicobarney/status/1024851919733444608
FBuenoF;2018-08-01 23:55;136;864;"Ciro Gomes anos luz mais preparado q os outros candidatos! #CiroNaGloboNews";;;#CiroNaGloboNews;"1024851079429857280";https://twitter.com/FBuenoF/status/1024851079429857280
leticiatrebor1;2018-08-01 23:54;77;619;"Ciro Gomes é um dos mais preparados pelo o que eu vi, quando é perguntado sobre algo, sempre responde! Diferente dos outros. #CiroNaGloboNews";;;#CiroNaGloboNews;"1024850918402142209";https://twitter.com/leticiatrebor1/status/1024850918402142209
olivagabond;2018-08-01 23:52;39;226;"o ciro gomes culpando os bancos de saquear o país e falando palavrão ao vivo me representa bastante";;;;"1024850343845416960";https://twitter.com/olivagabond/status/1024850343845416960
renatothibes;2018-08-01 23:49;342;1496;"Se eu sou do marketing do Ciro Gomes eu faço uns boneco inflável do Cirinho Pistola e pronto, pode entregar as faixas.";;;;"1024849567483928576";https://twitter.com/renatothibes/status/1024849567483928576
